{
  "version": "0.2.0",
  "kernel_id": "fused_matmul_relu",
  "params": [
    {
      "name": "A",
      "shape": [
        1024,
        1024
      ],
      "dtype": "f16",
      "layout": "row_major"
    },
    {
      "name": "B",
      "shape": [
        1024,
        1024
      ],
      "dtype": "f16",
      "layout": "row_major"
    }
  ],
  "return_type": {
    "shape": [
      1024,
      1024
    ],
    "dtype": "f16",
    "layout": "row_major"
  },
  "nodes": [
    {
      "id": "matmul_0",
      "op": "matmul",
      "inputs": {
        "A": {
          "ref": "param",
          "name": "A"
        },
        "B": {
          "ref": "param",
          "name": "B"
        }
      },
      "output": {
        "shape": [
          1024,
          1024
        ],
        "dtype": "f16",
        "layout": "row_major"
      },
      "semantics": {
        "computation": "C[i,j] = sum(A[i,k] * B[k,j], axis=k)",
        "index_vars": [
          "i",
          "j",
          "k"
        ],
        "reduction_axes": [
          "k"
        ],
        "properties": [
          "associative",
          "distributive"
        ]
      }
    },
    {
      "id": "relu_1",
      "op": "relu",
      "inputs": {
        "X": {
          "ref": "node",
          "id": "matmul_0"
        }
      },
      "output": {
        "shape": [
          1024,
          1024
        ],
        "dtype": "f16",
        "layout": "row_major"
      },
      "semantics": {
        "computation": "Y = max(X, 0)",
        "index_vars": [],
        "reduction_axes": [],
        "properties": [
          "elementwise",
          "monotonic"
        ]
      }
    }
  ],
  "edges": [
    {
      "from_node": "matmul_0",
      "to_node": "relu_1",
      "tensor_name": "matmul_0_out",
      "lifetime": "local"
    }
  ],
  "return_node": "relu_1",
  "fusion_groups": [
    {
      "id": "fg_matmul_0_relu_1",
      "nodes": [
        "matmul_0",
        "relu_1"
      ],
      "fusion_type": "epilogue",
      "reason": "relu is elementwise; can fuse into epilogue"
    }
  ]
}